39,Abmreviews.nft,,Abmreviews,,Sun Oct 03 02:24:38 +0000 2021,56,137,13,637,"Let this NYSC @officialnyscng scheme be scrapped completely and replaced with a #VOCATIONAL Skill Training Program and let the individual have the options to choose where they would learn the skills and what they wish to learn

It's that simple...

#TinubuIsaTerriblePresident https://t.co/BnRXunkGfK",Tue Mar 18 12:29:09 +0000 2025,0,0,en,55,False,False,0,0,,"['VOCATIONAL', 'TinubuIsaTerriblePresident']",False,55,0,False,False,13,637,"[{'display_url': 'pic.x.com/BnRXunkGfK', 'expanded_url': 'https://x.com/Abmreviews/status/1901974151239205062/photo/1', 'id_str': '1901974139243483137', 'indices': [277, 300], 'media_key': '3_1901974139243483137', 'media_url_https': 'https://pbs.twimg.com/media/GmUrZw2WUAET9rG.jpg', 'type': 'photo', 'url': 'https://t.co/BnRXunkGfK', 'ext_media_availability': {'status': 'Available'}, 'features': {'large': {'faces': [{'x': 1005, 'y': 13, 'h': 130, 'w': 130}]}, 'medium': {'faces': [{'x': 942, 'y': 12, 'h': 121, 'w': 121}]}, 'small': {'faces': [{'x': 533, 'y': 6, 'h': 69, 'w': 69}]}, 'orig': {'faces': [{'x': 1005, 'y': 13, 'h': 130, 'w': 130}]}}, 'sizes': {'large': {'h': 720, 'w': 1280, 'resize': 'fit'}, 'medium': {'h': 675, 'w': 1200, 'resize': 'fit'}, 'small': {'h': 383, 'w': 680, 'resize': 'fit'}, 'thumb': {'h': 150, 'w': 150, 'resize': 'crop'}}, 'original_info': {'height': 720, 'width': 1280, 'focus_rects': [{'x': 0, 'y': 0, 'w': 1280, 'h': 717}, {'x': 0, 'y': 0, 'w': 720, 'h': 720}, {'x': 0, 'y': 0, 'w': 632, 'h': 720}, {'x': 0, 'y': 0, 'w': 360, 'h': 720}, {'x': 0, 'y': 0, 'w': 1280, 'h': 720}]}, 'media_results': {'result': {'media_key': '3_1901974139243483137'}}}]","Let this NYSC @officialnyscng scheme be scrapped completely and replaced with a #VOCATIONAL Skill Training Program and let the individual have the options to choose where they would learn the skills and what they wish to learn

It's that simple...

#TinubuIsaTerriblePresident https://t.co/BnRXunkGfK"
40,Channels Television,https://t.co/8UPmxt8H3Y,channelstv,Nigeria,Mon Mar 22 14:29:10 +0000 2010,7255985,191,141961,217495,"NYSC DG Kicks Against Scrapping Scheme, Says Reforms Ongoing https://t.co/VPMzv2yI6N",Fri Apr 04 11:23:04 +0000 2025,23,233,en,30564,True,False,2,34,,[],False,30564,23,False,False,141961,217495,"[{'display_url': 'pic.x.com/VPMzv2yI6N', 'expanded_url': 'https://x.com/channelstv/status/1908118117491818824/video/1', 'id_str': '1908116893564653568', 'indices': [61, 84], 'media_key': '13_1908116893564653568', 'media_url_https': 'https://pbs.twimg.com/media/Gnr_I5yWkAAUBPr.jpg', 'type': 'video', 'url': 'https://t.co/VPMzv2yI6N', 'additional_media_info': {'title': '', 'description': '', 'embeddable': True, 'monetizable': False}, 'ext_media_availability': {'status': 'Available'}, 'sizes': {'large': {'h': 360, 'w': 640, 'resize': 'fit'}, 'medium': {'h': 360, 'w': 640, 'resize': 'fit'}, 'small': {'h': 360, 'w': 640, 'resize': 'fit'}, 'thumb': {'h': 150, 'w': 150, 'resize': 'crop'}}, 'original_info': {'height': 360, 'width': 640, 'focus_rects': []}, 'allow_download_status': {'allow_download': False}, 'video_info': {'aspect_ratio': [16, 9], 'duration_millis': 154824, 'variants': [{'content_type': 'application/x-mpegURL', 'url': 'https://video.twimg.com/amplify_video/1908116893564653568/pl/i-7AwDxNfsWxduUX.m3u8?tag=14'}, {'bitrate': 288000, 'content_type': 'video/mp4', 'url': 'https://video.twimg.com/amplify_video/1908116893564653568/vid/avc1/480x270/j_qeizWro1latEI8.mp4?tag=14'}, {'bitrate': 832000, 'content_type': 'video/mp4', 'url': 'https://video.twimg.com/amplify_video/1908116893564653568/vid/avc1/640x360/FGkkKxQC2yNSnpZt.mp4?tag=14'}, {'bitrate': 2176000, 'content_type': 'video/mp4', 'url': 'https://video.twimg.com/amplify_video/1908116893564653568/vid/avc1/1280x720/ZjzQOqMlEYipLB-C.mp4?tag=14'}]}, 'media_results': {'result': {'media_key': '13_1908116893564653568'}}}]","NYSC DG Kicks Against Scrapping Scheme, Says Reforms Ongoing https://t.co/VPMzv2yI6N"
41,Osi,https://t.co/GxSlH3ZBW7,Osi_Suave,Lagos | Newyork,Sat Oct 31 23:21:38 +0000 2009,199970,3166,10504,308934,"The NYSC has outlived its usefulness. 

It should be made voluntary or scrapped in totality.  

Give each graduate 840k as grant after they leave university and call it a day abeg.",Wed Jan 22 05:45:24 +0000 2025,1981,9597,en,964659,True,False,295,312,,[],,964659,1981,False,False,10504,308934,,"The NYSC has outlived its usefulness. 

It should be made voluntary or scrapped in totality.  

Give each graduate 840k as grant after they leave university and call it a day abeg."
42,👑ADEYEMI👑,,ABAYOMIOLAWALEE,"Lagos, Delta Nigeria",Sat Jun 11 18:43:18 +0000 2016,3193,5002,3400,69254,NYSC lost its value Long time ago and should be Scrapped..,Sat Apr 05 14:18:45 +0000 2025,0,0,en,58,False,False,0,0,,[],,58,0,False,True,3400,69254,,NYSC lost its value Long time ago and should be Scrapped..
43,Haven Designs,https://t.co/EQQI0HqzcV,Sucrpapito1,figma,Sun Jun 07 10:07:31 +0000 2020,716,614,81,1026,"I think nysc should be scrapped 
I suffer for nysc mehn",Mon Mar 17 13:39:34 +0000 2025,0,1,en,56,False,False,0,0,,[],,56,0,False,False,81,1026,,"I think nysc should be scrapped 
I suffer for nysc mehn"
44,Chris Emeka,https://t.co/BRlmt2WD9D,CE1O_,,Sat Feb 19 14:20:09 +0000 2022,68,108,6,667,NYSC is bullshit and should be scrapped.,Mon Mar 17 18:26:47 +0000 2025,0,0,en,71,False,False,0,0,,[],,71,0,False,True,6,667,,NYSC is bullshit and should be scrapped.
45,Mr.May,https://t.co/YjvFbBs4cK,MayAgbe2sin,"Stillwater, OK",Fri Sep 28 23:49:11 +0000 2012,400,496,50,2794,Nigeria needs to scrap NYSC completely.,Wed Apr 02 08:03:26 +0000 2025,0,0,en,67,False,False,0,1,,[],,67,0,False,True,50,2794,,Nigeria needs to scrap NYSC completely.
46,Opay Cards FUTA,,Roderickfacts,"Akure, Nigeria.",Fri Jul 26 05:28:40 +0000 2024,2,79,3,57,"NYSC posting should be scrapped...Why should a Person born outside his state of origin or to an Inter-tribal family be made to spend just 1 year in a different state just to promote National unity. 

I am not against the Service, I am against the posting to random states.",Mon Mar 17 14:29:41 +0000 2025,0,0,en,53,False,False,0,0,,[],,53,0,False,False,3,57,,"NYSC posting should be scrapped...Why should a Person born outside his state of origin or to an Inter-tribal family be made to spend just 1 year in a different state just to promote National unity. 

I am not against the Service, I am against the posting to random states."
47,Peace Aya 🇳🇬,https://t.co/MchKdKTEl1,peace__aya,"Abuja, Nigeria",Tue Oct 01 19:35:20 +0000 2019,637,573,86,1275,I strongly believe NYSC has outlived its purpose. It should be SCRAPPED already. #NYSC,Mon Mar 17 07:55:22 +0000 2025,0,1,en,57,False,False,0,0,,['NYSC'],,57,0,False,True,86,1275,,I strongly believe NYSC has outlived its purpose. It should be SCRAPPED already. #NYSC
48,Chinonyelum🪭,,Nonyelum___,Lagos|Enugu📍,Fri Oct 23 10:31:45 +0000 2020,627,257,1,8342,"God abeg, scrap NYSC before my turn reaches",Mon Mar 17 18:56:56 +0000 2025,2,8,en,319,False,False,0,2,,[],,319,2,False,False,1,8342,,"God abeg, scrap NYSC before my turn reaches"
49,Bàbájídé B𝗹𝘂𝗻𝘁,https://t.co/WXoO8Clprf,CRawkeen,Songhai empire,Tue Jul 30 05:24:35 +0000 2013,53126,8984,4601,204241,"You can say scrap NYSC because you don't understand the latent functions this scheme performs. You're only seeing it from the viewpoint of the intended functions that you probably think are no longer unnecessary. Whereas, there are so many unintended functions it performs. You",Sun Mar 16 14:29:36 +0000 2025,179,786,en,94759,True,False,40,74,,[],,94759,179,False,True,4601,204241,,"You can say scrap NYSC because you don't understand the latent functions this scheme performs. You're only seeing it from the viewpoint of the intended functions that you probably think are no longer unnecessary. Whereas, there are so many unintended functions it performs. You will only realise another mess you have created when the government finally says okay, let us scrap it then. 

Imagine the number of graduates we churn out in Nigeria annually hitting the job market directly. This is the huge number NYSC absorbs for one year and engages. Some of them get free accommodation alongside their stipends"
50,The Capstone,,Ernestwanche,,Thu Jul 04 22:11:58 +0000 2024,35,283,36,629,"NYSC should be reformed, even if it won't be scrapped. The game has changed, the country isn't what it used to be",Mon Mar 17 09:28:26 +0000 2025,0,1,en,136,False,False,0,1,,[],,136,0,False,True,36,629,,"NYSC should be reformed, even if it won't be scrapped. The game has changed, the country isn't what it used to be"
51,chuksss.,,enwereimmanuel,,Thu Apr 21 16:39:14 +0000 2022,4052,3840,223,3728,"With the way things are going now, let them scrap NYSC before I graduate. I ain't doing that shit, man",Mon Mar 17 18:07:18 +0000 2025,3,21,en,817,False,False,0,3,,[],,817,3,False,True,223,3728,,"With the way things are going now, let them scrap NYSC before I graduate. I ain't doing that shit, man"
52,odiny,https://t.co/hQu9I2CUHS,odny_owen,,Mon Jun 20 00:11:04 +0000 2016,211,803,44,3867,"If FG can't pay Corp members 250k and above, they should scrap NYSC!!! 77K IS JUST PEANUT!!",Sun Mar 30 07:44:13 +0000 2025,2,6,en,248,False,False,1,1,,[],,248,2,False,False,44,3867,,"If FG can't pay Corp members 250k and above, they should scrap NYSC!!! 77K IS JUST PEANUT!!"
53,girl so confusing,https://t.co/4Tpzu41n1W,sobryeti,"superego, demureville",Fri Oct 09 16:06:11 +0000 2020,301,291,132,11770,what are the odds of this nysc scheme being scrapped before it's my turn 🥹,Tue Mar 25 11:12:42 +0000 2025,0,0,en,53,False,False,0,1,,[],,53,0,False,False,132,11770,,what are the odds of this nysc scheme being scrapped before it's my turn 🥹
54,Nze,,Poseidon21346,Hither & Dither,Sat Jun 13 18:24:32 +0000 2009,972,822,441,14008,"I firmly believe that the NYSC scheme should be reformed or scrapped.

@officialnyscng",Mon Mar 17 10:28:32 +0000 2025,0,0,en,55,False,False,0,0,,[],,55,0,False,False,441,14008,,"I firmly believe that the NYSC scheme should be reformed or scrapped.

@officialnyscng"
55,Obianuju🇲🇽,,Milcahdesigns,Nigeria,Mon Aug 28 00:31:41 +0000 2017,1831,388,2,76364,This is a sign that NYSC should be scrapped,Thu Mar 20 18:08:38 +0000 2025,0,4,en,142,False,False,0,1,,[],,142,0,False,False,2,76364,,This is a sign that NYSC should be scrapped
56,Naija,https://t.co/9vgVpPPFpC,Naija_PR,Nigeria,Tue Sep 24 18:00:41 +0000 2013,6809162,187462,180769,386262,Do you think NYSC should be scrapped?,Sun Mar 16 12:39:08 +0000 2025,379,3908,en,214449,True,False,210,1013,,[],,214449,379,False,False,180769,386262,,Do you think NYSC should be scrapped?
57,David Linus,,DavidLinus18,West Africa,Wed Mar 13 21:54:20 +0000 2019,766,2455,472,11010,To serve Nigeria is not by force. NYSC should be optional or be scrapped in this hard economy.,Mon Mar 17 12:59:46 +0000 2025,0,0,en,52,False,False,0,0,,[],,52,0,False,True,472,11010,,To serve Nigeria is not by force. NYSC should be optional or be scrapped in this hard economy.
58,Goga,,Thebrains__,My babe’s heart,Sat Jul 16 12:26:48 +0000 2016,3428,2931,323,48299,"Another set of NYSC complaints 
Scrap this shit",Mon Apr 07 10:28:55 +0000 2025,6,29,en,1440,False,False,0,2,,[],,1440,6,False,True,323,48299,,"Another set of NYSC complaints 
Scrap this shit"
59,De Mafioso,,Deoolu,,Sat May 15 18:06:54 +0000 2010,643,567,21,17013,"Come on man, @DrTunjiAlausa this shouldn't be coming from you. NYSC should be scrapped.",Sat Apr 05 16:52:55 +0000 2025,0,0,en,27,False,False,0,0,,[],,27,0,False,True,21,17013,,"Come on man, @DrTunjiAlausa this shouldn't be coming from you. NYSC should be scrapped."
60,"EMMANUEL NWONU CHINONYELUM, B eng, FNACOMES",,EmmaChrisNwonu,"Awka, Nigeria",Wed May 01 21:38:24 +0000 2024,15,59,6,214,"NYSC should be scrapped, it makes no meaning wasting a year of one's life without paying the person",Mon Mar 17 20:24:15 +0000 2025,0,1,en,23,False,False,0,0,,[],,23,0,False,False,6,214,,"NYSC should be scrapped, it makes no meaning wasting a year of one's life without paying the person"
61,Obidient Movement Parody,https://t.co/NTkv4kRVRD,obidientparody,"Abuja, Nigeria",Fri Mar 07 06:57:06 +0000 2025,53,14,161,497,"A must watch!
The NYSC needs to be scrapped. Nigerians ignored my 2018 campaign. 
Continue your foolishness 
#DrKemihealth https://t.co/XwqsEkqHEk",Mon Mar 17 12:36:07 +0000 2025,0,1,en,71,True,False,0,0,"<Place id=""00e55e2b4c491c5f"" name=""Abuja"">",['DrKemihealth'],False,71,0,False,True,161,497,"[{'display_url': 'pic.x.com/XwqsEkqHEk', 'expanded_url': 'https://x.com/obidientparody/status/1901613517574140212/video/1', 'id_str': '1901613255853780992', 'indices': [123, 146], 'media_key': '13_1901613255853780992', 'media_url_https': 'https://pbs.twimg.com/amplify_video_thumb/1901613255853780992/img/XgEpjGbzMOtvTs-z.jpg', 'type': 'video', 'url': 'https://t.co/XwqsEkqHEk', 'additional_media_info': {'monetizable': False}, 'ext_media_availability': {'status': 'Available'}, 'sizes': {'large': {'h': 1024, 'w': 576, 'resize': 'fit'}, 'medium': {'h': 1024, 'w': 576, 'resize': 'fit'}, 'small': {'h': 680, 'w': 383, 'resize': 'fit'}, 'thumb': {'h': 150, 'w': 150, 'resize': 'crop'}}, 'original_info': {'height': 1024, 'width': 576, 'focus_rects': []}, 'video_info': {'aspect_ratio': [9, 16], 'duration_millis': 603184, 'variants': [{'content_type': 'application/x-mpegURL', 'url': 'https://video.twimg.com/amplify_video/1901613255853780992/pl/P_rUDxCQjCXHJoME.m3u8?tag=14'}, {'bitrate': 632000, 'content_type': 'video/mp4', 'url': 'https://video.twimg.com/amplify_video/1901613255853780992/vid/avc1/320x568/sZy6FC7BpxlRoat6.mp4?tag=14'}, {'bitrate': 950000, 'content_type': 'video/mp4', 'url': 'https://video.twimg.com/amplify_video/1901613255853780992/vid/avc1/480x852/IGwkJK7BMeP6FVyr.mp4?tag=14'}, {'bitrate': 2176000, 'content_type': 'video/mp4', 'url': 'https://video.twimg.com/amplify_video/1901613255853780992/vid/avc1/576x1024/5sc-58NdIs0Ul-9R.mp4?tag=14'}]}, 'media_results': {'result': {'media_key': '13_1901613255853780992'}}}]","A must watch!
The NYSC needs to be scrapped. Nigerians ignored my 2018 campaign. 
Continue your foolishness 
#DrKemihealth https://t.co/XwqsEkqHEk"
62,T👑,,Tolu_lope08,"Lagos, Nigeria",Tue Sep 03 20:49:53 +0000 2019,3132,561,8,8103,They should advocate to scrap this nysc abeg🙏,Fri Apr 04 21:31:05 +0000 2025,0,0,en,91,False,False,0,0,,[],,91,0,False,True,8,8103,,They should advocate to scrap this nysc abeg🙏
63,The sewing Chemist🌹✨,https://t.co/I0ile7lnGV,nifemi_oe,Nigeria,Wed Aug 26 15:53:39 +0000 2020,3462,994,837,39676,"In all this, they should even scrap the whole NYSC thing.",Mon Mar 17 14:47:23 +0000 2025,1,0,en,174,False,False,0,0,,[],,174,1,False,True,837,39676,,"In all this, they should even scrap the whole NYSC thing."
64,Okey,,obkzee,Earth,Sat Apr 09 23:35:48 +0000 2011,1944,2918,439,30288,"National Assembly first, cos NYSC will be scrapped.",Sun Apr 20 10:24:59 +0000 2025,0,0,en,70,False,False,0,0,,[],,70,0,False,False,439,30288,,"National Assembly first, cos NYSC will be scrapped."
65,Naija,https://t.co/9vgVpPPFpC,Naija_PR,Nigeria,Tue Sep 24 18:00:41 +0000 2013,6809160,187462,180769,386262,Whata your opinion about this. NYSC should be scrapped.,Sun Mar 16 18:50:31 +0000 2025,4,35,en,11358,True,False,0,18,,[],,11358,4,False,False,180769,386262,,Whata your opinion about this. NYSC should be scrapped.
66,Sir Tee,,iameneji,"Lagos, Nigeria",Sun Dec 16 09:17:18 +0000 2012,70618,22144,6152,174969,"Scrap the NYSC, please. Scrap it!!!",Mon Mar 17 19:26:57 +0000 2025,1,2,en,589,False,False,0,2,,[],,589,1,False,False,6152,174969,,"Scrap the NYSC, please. Scrap it!!!"
67,WizkidFcinCanada🦅🍁,,LionBalo,Canada,Fri Jul 14 08:21:40 +0000 2023,19,22,21,2942,"Nysc should be scrapped 
#TinubuIsaTerriblePresident 
#30daysrantchallenge",Mon Mar 17 17:34:57 +0000 2025,0,0,en,80,False,False,0,0,,"['TinubuIsaTerriblePresident', '30daysrantchallenge']",,80,0,False,False,21,2942,,"Nysc should be scrapped 
#TinubuIsaTerriblePresident 
#30daysrantchallenge"
68,General Iroh,,Coodagz,"Lyon, France",Thu Jul 21 18:24:45 +0000 2011,507,897,1289,11941,"NYSC should be scrapped. It offers no benefit, rather it has taken the lives of many young Nigerians, and it has scarred many families.
#30DayRantChallenge 
#30daysrantchallenge",Mon Mar 17 12:41:55 +0000 2025,1,2,en,126,False,False,0,0,,"['30DayRantChallenge', '30daysrantchallenge']",,126,1,False,False,1289,11941,,"NYSC should be scrapped. It offers no benefit, rather it has taken the lives of many young Nigerians, and it has scarred many families.
#30DayRantChallenge 
#30daysrantchallenge"
69,Davidson,,legaldavidson,"Lagos, Nigeria",Thu May 13 22:14:25 +0000 2021,794,481,971,5317,"@instablog9ja Nothing wrong with it sha 
But NYSC is scrap and should be scrapped out",Mon Mar 17 10:22:32 +0000 2025,0,0,en,60,False,False,0,0,,[],,60,0,False,True,971,5317,,"@instablog9ja Nothing wrong with it sha 
But NYSC is scrap and should be scrapped out"
70,Naija,https://t.co/9vgVpPPFpC,Naija_PR,Nigeria,Tue Sep 24 18:00:41 +0000 2013,6809160,187462,180769,386262,What is your thought about this. Nysc should be scrapped👇,Sun Mar 16 18:36:08 +0000 2025,6,33,en,11860,True,False,0,17,,[],,11860,6,False,False,180769,386262,,What is your thought about this. Nysc should be scrapped👇
71,Naija,https://t.co/9vgVpPPFpC,Naija_PR,Nigeria,Tue Sep 24 18:00:41 +0000 2013,6809160,187462,180769,386262,Do you still want them to scrap NYSC? https://t.co/vxqGaWWQzH,Thu Oct 26 14:36:02 +0000 2023,62,879,en,48770,True,False,2,46,,[],False,48770,62,False,False,180769,386262,"[{'display_url': 'pic.x.com/vxqGaWWQzH', 'expanded_url': 'https://x.com/Naija_PR/status/1717550658251833802/photo/1', 'id_str': '1717550649095622656', 'indices': [38, 61], 'media_key': '3_1717550649095622656', 'media_url_https': 'https://pbs.twimg.com/media/F9X3NyMWEAAfeX-.jpg', 'type': 'photo', 'url': 'https://t.co/vxqGaWWQzH', 'ext_media_availability': {'status': 'Available'}, 'features': {'large': {'faces': []}, 'medium': {'faces': []}, 'small': {'faces': []}, 'orig': {'faces': []}}, 'sizes': {'large': {'h': 2048, 'w': 2048, 'resize': 'fit'}, 'medium': {'h': 1200, 'w': 1200, 'resize': 'fit'}, 'small': {'h': 680, 'w': 680, 'resize': 'fit'}, 'thumb': {'h': 150, 'w': 150, 'resize': 'crop'}}, 'original_info': {'height': 2048, 'width': 2048, 'focus_rects': [{'x': 0, 'y': 502, 'w': 2048, 'h': 1147}, {'x': 0, 'y': 0, 'w': 2048, 'h': 2048}, {'x': 0, 'y': 0, 'w': 1796, 'h': 2048}, {'x': 0, 'y': 0, 'w': 1024, 'h': 2048}, {'x': 0, 'y': 0, 'w': 2048, 'h': 2048}]}, 'media_results': {'result': {'media_key': '3_1717550649095622656'}}}]",Do you still want them to scrap NYSC? https://t.co/vxqGaWWQzH
72,HS Dambo,,_ayhassandambo,"Kaduna, Nigeria",Sun Nov 05 08:27:25 +0000 2017,2900,3762,131,8111,NYSC should either be scrapped or make it optional to every graduates.There's no point in having a system that is exploitative rebasing on fraud at the expense of each Corp member.,Mon Mar 17 18:52:07 +0000 2025,0,1,en,117,False,False,0,1,,[],,117,0,False,False,131,8111,,NYSC should either be scrapped or make it optional to every graduates.There's no point in having a system that is exploitative rebasing on fraud at the expense of each Corp member.
73,Ekemtime of DesignEra,,Ekemtime_,Somewhere on Earth,Fri Jan 15 09:37:23 +0000 2016,2243,1987,565,24373,"Let them suffer. 
I come from a rural area, I saw what these people did in elections. 
Scrap NYSC!",Mon Mar 17 08:16:30 +0000 2025,1,5,en,141,False,False,0,0,,[],,141,1,False,False,565,24373,,"Let them suffer. 
I come from a rural area, I saw what these people did in elections. 
Scrap NYSC!"
74,city boy😈🏴‍☠️,,thatboytemii,,Wed Mar 22 16:37:30 +0000 2023,1196,7311,47,964,"I feel like Nysc should be scrapped fr…..

one year compulsory military service will be better 👀🌚",Fri Mar 28 14:59:39 +0000 2025,0,0,en,80,False,False,0,0,,[],,80,0,False,False,47,964,,"I feel like Nysc should be scrapped fr…..

one year compulsory military service will be better 👀🌚"
75,LATORERA ✨🖤,https://t.co/iuq3XSez6n,big_leemah_,"Ilorin, Nigeria",Sun Sep 03 20:35:39 +0000 2023,822,947,30,1221,"Let me just say this, I’ve never been a fan of NYSC. Nigeria isn’t worth a year of anyone’s life, and the government doesn’t even prioritize the welfare of corps members. 

I’ve never wanted to serve Nigeria, and I never will. I honestly hope NYSC gets scrapped.",Mon Mar 17 18:38:47 +0000 2025,0,10,en,191,False,False,0,3,,[],,191,0,False,False,30,1221,,"Let me just say this, I’ve never been a fan of NYSC. Nigeria isn’t worth a year of anyone’s life, and the government doesn’t even prioritize the welfare of corps members. 

I’ve never wanted to serve Nigeria, and I never will. I honestly hope NYSC gets scrapped."
76,Therealleojnr,,Leoorekyehjnr,Lagos ,Tue Apr 19 20:05:30 +0000 2022,69,516,7,298,"NYSC should totally be scrapped, since inception till date I can't find any positive addition, our graduates should be mobilized on adding value economically by empowering them into various schemes and programs , not recruiting now and after we have jobless youths !!!
#NYSC",Tue Mar 18 14:37:55 +0000 2025,0,0,en,33,False,False,0,0,,['NYSC'],,33,0,False,False,7,298,,"NYSC should totally be scrapped, since inception till date I can't find any positive addition, our graduates should be mobilized on adding value economically by empowering them into various schemes and programs , not recruiting now and after we have jobless youths !!!
#NYSC"
77,Rukie.M,,Rukielifestyle,,Sun Jan 03 22:29:24 +0000 2010,2223,832,1973,83984,"Scrap NYSC e be like say some of you want education in your villages to collapse. 

Even your governors no go gree.",Tue Mar 18 11:36:37 +0000 2025,0,1,en,51,False,False,0,0,,[],,51,0,False,False,1973,83984,,"Scrap NYSC e be like say some of you want education in your villages to collapse. 

Even your governors no go gree."
78,Ayodeji Kolawole,,Xanonymousworld,World ,Wed Mar 30 22:51:56 +0000 2022,4824,3927,786,13163,"Should NYSC be scrapped?

a) End it, it’s useless
b) Keep it, but optional
c) Reform it for skills
d) Make it mandatory forever",Tue Mar 25 07:48:20 +0000 2025,0,7,en,202,True,False,0,13,,[],,202,0,False,True,786,13163,,"Should NYSC be scrapped?

a) End it, it’s useless
b) Keep it, but optional
c) Reform it for skills
d) Make it mandatory forever"
79,Gbemi O-O,https://t.co/hilVfPkGQI,GbemiOO,,Sun May 24 13:09:15 +0000 2009,568589,2063,4511,88655,I have always said NYSC should be scrapped anyway. It doesn’t make any sense.,Sun Mar 16 09:26:24 +0000 2025,241,587,en,593425,False,False,56,26,,[],,593425,241,False,False,4511,88655,,I have always said NYSC should be scrapped anyway. It doesn’t make any sense.
80,Toheeb Yusuf,,TByusuff,Advertising,Thu Oct 10 15:17:15 +0000 2019,3393,476,355,11129,"Good points.

But there's a better way.

Scrap NYSC, create Learning Hubs for Digital Skills across all 36 states.

Pick your state yourself, Join one of the learning Hub. (Could be in the capital city)

That's a better Initiative, 

No amount of Gaslighting can change my mind.",Mon Mar 17 11:41:18 +0000 2025,0,11,en,594,False,False,0,2,,[],,594,0,False,True,355,11129,,"Good points.

But there's a better way.

Scrap NYSC, create Learning Hubs for Digital Skills across all 36 states.

Pick your state yourself, Join one of the learning Hub. (Could be in the capital city)

That's a better Initiative, 

No amount of Gaslighting can change my mind."
81,Conservative_Yoruba,,CYoruba27445,"Lagos, Nigeria",Mon Sep 09 03:14:50 +0000 2024,1823,1646,136,14406,"Why does NYSC keeping sending enemies to SW for NYSC, like this foool below? NYSC should be scrapped! https://t.co/60peYpXN5U",Mon Mar 17 04:15:00 +0000 2025,3,16,en,337,True,False,0,6,,[],False,337,3,False,True,136,14406,"[{'display_url': 'pic.x.com/60peYpXN5U', 'expanded_url': 'https://x.com/CYoruba27445/status/1901487408253751666/photo/1', 'id_str': '1901483313002389504', 'indices': [102, 125], 'media_key': '3_1901483313002389504', 'media_url_https': 'https://pbs.twimg.com/media/GmNs_6nXIAAfisp.png', 'type': 'photo', 'url': 'https://t.co/60peYpXN5U', 'ext_media_availability': {'status': 'Available'}, 'features': {'large': {'faces': []}, 'medium': {'faces': []}, 'small': {'faces': []}, 'orig': {'faces': []}}, 'sizes': {'large': {'h': 522, 'w': 664, 'resize': 'fit'}, 'medium': {'h': 522, 'w': 664, 'resize': 'fit'}, 'small': {'h': 522, 'w': 664, 'resize': 'fit'}, 'thumb': {'h': 150, 'w': 150, 'resize': 'crop'}}, 'original_info': {'height': 522, 'width': 664, 'focus_rects': [{'x': 0, 'y': 0, 'w': 664, 'h': 372}, {'x': 0, 'y': 0, 'w': 522, 'h': 522}, {'x': 0, 'y': 0, 'w': 458, 'h': 522}, {'x': 19, 'y': 0, 'w': 261, 'h': 522}, {'x': 0, 'y': 0, 'w': 664, 'h': 522}]}, 'allow_download_status': {'allow_download': True}, 'media_results': {'result': {'media_key': '3_1901483313002389504'}}}]","Why does NYSC keeping sending enemies to SW for NYSC, like this foool below? NYSC should be scrapped! https://t.co/60peYpXN5U"
82,Kings,,Rexbasil1,,Thu Apr 14 16:00:32 +0000 2022,606,685,1658,25743,NYSC should be scrapped off since a sitting president doesn't possess it.,Mon Mar 17 01:57:30 +0000 2025,0,1,en,102,False,False,0,0,,[],,102,0,False,False,1658,25743,,NYSC should be scrapped off since a sitting president doesn't possess it.
