112,zingerfx_,,lazfranklin71,somewhere on Earth,Thu May 19 19:25:15 +0000 2022,3271,4272,1192,11784,If NYSC can't pay corpers 500k that shit should be scrapped off 🥸🫵🧘.,Sun Mar 30 08:29:06 +0000 2025,0,0,en,45,True,False,0,0,,[],,45,0,False,True,1192,11784,,If NYSC can't pay corpers 500k that shit should be scrapped off 🥸🫵🧘.
113,Punch Newspapers,https://t.co/JwPtwCGMPv,MobilePunch,"Lagos, Nigeria",Sat Mar 14 00:27:10 +0000 2009,6993200,2109,117257,713297,"#Punchnewspapers #Opinion 
 ""NYSC withdraws corpers from Osun State""
  Should NYSC be reviewed or scrapped?   
  Do share your views https://t.co/SDqttugq7z",Fri Mar 16 14:10:46 +0000 2018,8,8,en,,True,False,1,9,"<Place id=""59b27337f38d658b"" name=""Nigeria"">","['Punchnewspapers', 'Opinion']",False,,8,False,False,117257,713297,"[{'display_url': 'pic.x.com/SDqttugq7z', 'expanded_url': 'https://x.com/MobilePunch/status/974649177211834369/photo/1', 'id_str': '974649153824358406', 'indices': [133, 156], 'media_key': '3_974649153824358406', 'media_url_https': 'https://pbs.twimg.com/media/DYamPdJWAAYOTOt.jpg', 'type': 'photo', 'url': 'https://t.co/SDqttugq7z', 'ext_media_availability': {'status': 'Available'}, 'features': {'large': {'faces': []}, 'medium': {'faces': []}, 'small': {'faces': []}, 'orig': {'faces': []}}, 'sizes': {'large': {'h': 400, 'w': 300, 'resize': 'fit'}, 'medium': {'h': 400, 'w': 300, 'resize': 'fit'}, 'small': {'h': 400, 'w': 300, 'resize': 'fit'}, 'thumb': {'h': 150, 'w': 150, 'resize': 'crop'}}, 'original_info': {'height': 400, 'width': 300, 'focus_rects': [{'x': 0, 'y': 66, 'w': 300, 'h': 168}, {'x': 0, 'y': 0, 'w': 300, 'h': 300}, {'x': 0, 'y': 0, 'w': 300, 'h': 342}, {'x': 100, 'y': 0, 'w': 200, 'h': 400}, {'x': 0, 'y': 0, 'w': 300, 'h': 400}]}, 'media_results': {'result': {'media_key': '3_974649153824358406'}}}]","#Punchnewspapers #Opinion 
 ""NYSC withdraws corpers from Osun State""
  Should NYSC be reviewed or scrapped?   
  Do share your views https://t.co/SDqttugq7z"
114,Oliver De Johnson,,obaoftech,"Lagos, Nigeria",Fri May 30 08:36:45 +0000 2014,1245,1390,178,13128,"Nigerians are calling for the scrap of NYSC, politicians are calling for its extension and expansion. 

Tells you the people truly benefiting from this scheme.",Sun Apr 06 11:08:43 +0000 2025,0,1,en,55,False,False,0,0,,[],,55,0,False,True,178,13128,,"Nigerians are calling for the scrap of NYSC, politicians are calling for its extension and expansion. 

Tells you the people truly benefiting from this scheme."
115,Naija,https://t.co/9vgVpPPFpC,Naija_PR,Nigeria,Tue Sep 24 18:00:41 +0000 2013,6809160,187462,180769,386262,Should NYSC be scrapped ?,Sat Jan 25 19:22:03 +0000 2025,8,64,en,23255,True,False,1,35,,[],,23255,8,False,False,180769,386262,,Should NYSC be scrapped ?
116,Naija,https://t.co/9vgVpPPFpC,Naija_PR,Nigeria,Tue Sep 24 18:00:41 +0000 2013,6809160,187462,180769,386262,Minister of Youths and Sports. Dismisses claims that NYSC will be scrapped https://t.co/w5caHjszkZ,Wed May 26 07:52:43 +0000 2021,13,53,en,,True,False,1,9,,[],False,,13,False,False,180769,386262,"[{'display_url': 'pic.x.com/w5caHjszkZ', 'expanded_url': 'https://x.com/Naija_PR/status/1397460676784832514/photo/1', 'id_str': '1397460652499902469', 'indices': [75, 98], 'media_key': '3_1397460652499902469', 'media_url_https': 'https://pbs.twimg.com/media/E2THDzPXoAUlMwR.jpg', 'type': 'photo', 'url': 'https://t.co/w5caHjszkZ', 'ext_media_availability': {'status': 'Available'}, 'features': {'large': {'faces': []}, 'medium': {'faces': []}, 'small': {'faces': []}, 'orig': {'faces': []}}, 'sizes': {'large': {'h': 98, 'w': 458, 'resize': 'fit'}, 'medium': {'h': 98, 'w': 458, 'resize': 'fit'}, 'small': {'h': 98, 'w': 458, 'resize': 'fit'}, 'thumb': {'h': 98, 'w': 98, 'resize': 'crop'}}, 'original_info': {'height': 98, 'width': 458, 'focus_rects': [{'x': 0, 'y': 0, 'w': 175, 'h': 98}, {'x': 31, 'y': 0, 'w': 98, 'h': 98}, {'x': 37, 'y': 0, 'w': 86, 'h': 98}, {'x': 56, 'y': 0, 'w': 49, 'h': 98}, {'x': 0, 'y': 0, 'w': 458, 'h': 98}]}, 'media_results': {'result': {'media_key': '3_1397460652499902469'}}}]",Minister of Youths and Sports. Dismisses claims that NYSC will be scrapped https://t.co/w5caHjszkZ
117,Jehu,,JehuSword,"London, UK | Lagos",Sun Jun 05 13:07:05 +0000 2022,414,1580,161,4721,"@Ifagbohunmi @Elemesoh @NwannemTV @Bayo_Bilisi @the_mindsetgirl I firmly believe NYSC should be scrapped. It disadvantages young Yorubas. They are sent to serve in God-forsaken hell holes, while people from these regions get plum postings to Lagos and nice places in Yorubaland. When they return from NYSC, their jobs have been taken by aliens.",Thu Apr 10 13:15:53 +0000 2025,8,30,en,1367,False,False,0,0,,[],,1367,8,False,False,161,4721,,"@Ifagbohunmi @Elemesoh @NwannemTV @Bayo_Bilisi @the_mindsetgirl I firmly believe NYSC should be scrapped. It disadvantages young Yorubas. They are sent to serve in God-forsaken hell holes, while people from these regions get plum postings to Lagos and nice places in Yorubaland. When they return from NYSC, their jobs have been taken by aliens."
118,Nomad,,N0mhad,oasis,Thu Feb 27 00:14:18 +0000 2025,30,140,12,1125,"People saying NYSC should be scrapped don't understand the role this scheme plays in our society. Let's talk about the social inequality gap in our society how wide it is, and how rare it is for someone from a poor background to meet someone from a wealthy background on neutral",Mon Mar 17 20:48:58 +0000 2025,0,0,en,11,False,False,0,1,,[],,11,0,False,False,12,1125,,"People saying NYSC should be scrapped don't understand the role this scheme plays in our society. Let's talk about the social inequality gap in our society how wide it is, and how rare it is for someone from a poor background to meet someone from a wealthy background on neutral"
119,Naija,https://t.co/9vgVpPPFpC,Naija_PR,Nigeria,Tue Sep 24 18:00:41 +0000 2013,6809160,187462,180769,386262,"NYSC won’t be scrapped as it usefulness outweighs it challenges — Shuaibu Ibrahim, NYSC DG https://t.co/lroWjcsl6s",Fri Nov 19 05:24:45 +0000 2021,5,38,en,,True,False,1,8,,[],False,,5,False,False,180769,386262,"[{'display_url': 'pic.x.com/lroWjcsl6s', 'expanded_url': 'https://x.com/Naija_PR/status/1461566093512921088/photo/1', 'id_str': '1461566079118065667', 'indices': [91, 114], 'media_key': '3_1461566079118065667', 'media_url_https': 'https://pbs.twimg.com/media/FEiGmvGXwAMllI7.jpg', 'type': 'photo', 'url': 'https://t.co/lroWjcsl6s', 'ext_media_availability': {'status': 'Available'}, 'features': {'large': {'faces': [{'x': 151, 'y': 68, 'h': 98, 'w': 98}]}, 'medium': {'faces': [{'x': 151, 'y': 68, 'h': 98, 'w': 98}]}, 'small': {'faces': [{'x': 151, 'y': 68, 'h': 98, 'w': 98}]}, 'orig': {'faces': [{'x': 151, 'y': 68, 'h': 98, 'w': 98}]}}, 'sizes': {'large': {'h': 396, 'w': 640, 'resize': 'fit'}, 'medium': {'h': 396, 'w': 640, 'resize': 'fit'}, 'small': {'h': 396, 'w': 640, 'resize': 'fit'}, 'thumb': {'h': 150, 'w': 150, 'resize': 'crop'}}, 'original_info': {'height': 396, 'width': 640, 'focus_rects': [{'x': 0, 'y': 0, 'w': 640, 'h': 358}, {'x': 106, 'y': 0, 'w': 396, 'h': 396}, {'x': 131, 'y': 0, 'w': 347, 'h': 396}, {'x': 205, 'y': 0, 'w': 198, 'h': 396}, {'x': 0, 'y': 0, 'w': 640, 'h': 396}]}, 'media_results': {'result': {'media_key': '3_1461566079118065667'}}}]","NYSC won’t be scrapped as it usefulness outweighs it challenges — Shuaibu Ibrahim, NYSC DG https://t.co/lroWjcsl6s"
120,OTUNBA,,ManLikeIcey,JUPITER,Fri Dec 20 17:34:53 +0000 2013,115281,39930,12554,287871,"NYSC SHOULD BE SCRAPPED, IT IS A BIG SCAM.

THERE IS NO SINGLE BENEFIT ABOUT IT, IT IS TIME WASTING MONEY CONSUMING.",Sun Mar 16 10:00:19 +0000 2025,120,370,en,7274,True,False,3,17,,[],,7274,120,False,False,12554,287871,,"NYSC SHOULD BE SCRAPPED, IT IS A BIG SCAM.

THERE IS NO SINGLE BENEFIT ABOUT IT, IT IS TIME WASTING MONEY CONSUMING."
121,Nedu Ani,https://t.co/B4dO7gT4Gc,Nedumcity_,,Mon Mar 02 13:15:55 +0000 2020,14428,1740,2168,29596,"@PeterObi NYSC is a scam. It’s just a scheme for cohabitation. It should be scrapped asap. Beyond that, Lagos State smells. The odour of that state is oozing badly. Scrap NYSC now to save lives and marriages.",Sun Mar 16 20:43:36 +0000 2025,117,1537,en,106559,True,False,10,49,,[],,106559,117,False,True,2168,29596,,"@PeterObi NYSC is a scam. It’s just a scheme for cohabitation. It should be scrapped asap. Beyond that, Lagos State smells. The odour of that state is oozing badly. Scrap NYSC now to save lives and marriages."
122,Steiner Ekong 🐟,https://t.co/MObS86yHyE,steiner_ekong,Heaven ,Sat May 13 07:09:07 +0000 2017,1508,2485,594,11395,"NYSC should be scrapped out!
It’s a scheme used to loot money most especially the Middlemen!",Wed Mar 19 12:02:37 +0000 2025,0,0,en,44,False,False,0,0,,[],,44,0,False,True,594,11395,,"NYSC should be scrapped out!
It’s a scheme used to loot money most especially the Middlemen!"
123,Obafemi Awolowo (Parody of The Sage)🐐,https://t.co/ziAon2f5XC,TalkSpotNigeria,Africa,Fri Sep 14 10:56:44 +0000 2012,1497,3084,307,27062,Yoruba must begin to understand that the moment we speak with one voice the house will shake. NYSC should be scrapped if it can't be restructured just like Nigeria needs restructuring. You can't be posting Yoruba to underdeveloped region &amp; deprive them of economics opportunities.,Sat Apr 12 05:42:52 +0000 2025,1,16,en,574,False,False,0,2,,[],,574,1,False,False,307,27062,,Yoruba must begin to understand that the moment we speak with one voice the house will shake. NYSC should be scrapped if it can't be restructured just like Nigeria needs restructuring. You can't be posting Yoruba to underdeveloped region &amp; deprive them of economics opportunities.
124,Jalo,https://t.co/gCvBn2j8OD,abdulljalo,Nigeria,Sat Jul 11 17:18:12 +0000 2015,1717,988,1052,114045,"How I picked all Southern states 😆😆

The essence of NYSC is dead. Time to scrap it",Mon Apr 07 16:24:03 +0000 2025,2,0,en,505,False,False,0,1,,[],,505,2,False,True,1052,114045,,"How I picked all Southern states 😆😆

The essence of NYSC is dead. Time to scrap it"
125,Sincerelyjiggy,,sincerelyjiggy,,Mon Feb 03 17:10:49 +0000 2025,1787,1724,64,3462,That shit needs to be scrapped how person go finish school but e no fit see better job because say e never do nysc some jobs literally put it there no nysc certain no job🤦‍♂️,Sat Apr 05 21:01:51 +0000 2025,0,1,en,32,False,False,0,1,,[],,32,0,False,False,64,3462,,That shit needs to be scrapped how person go finish school but e no fit see better job because say e never do nysc some jobs literally put it there no nysc certain no job🤦‍♂️
126,Ahmad Zuntu💎,,zuntu_ashiru,Nigeria,Tue Nov 29 02:35:28 +0000 2022,1139,1262,486,13637,"Theost craziest thing I have seen in 2025. This people are serious at all, to my own opinion I will prefer NYSC being scrapped, corpers should be given their money kawai.",Sat Apr 05 16:39:03 +0000 2025,0,0,en,149,False,False,0,1,,[],,149,0,False,True,486,13637,,"Theost craziest thing I have seen in 2025. This people are serious at all, to my own opinion I will prefer NYSC being scrapped, corpers should be given their money kawai."
127,Emmanuel Odunfa.,,Iamcalled_Nuel,,Tue Aug 09 00:35:13 +0000 2011,5455,1347,8607,112965,"the whole concept of NYSC is dead. if at all it was alive, it died a long time ago, let it die peacefully. people are just endangering their lives for a government that doesn’t care.",Fri Apr 18 01:18:49 +0000 2025,0,2,en,121,False,False,0,0,,[],,121,0,False,True,8607,112965,,"the whole concept of NYSC is dead. if at all it was alive, it died a long time ago, let it die peacefully. people are just endangering their lives for a government that doesn’t care."
128,Bombom God,,ass_of_a_god,,Sun May 17 14:14:15 +0000 2020,1006,1907,1578,37016,"It was weird. Bring money for small contributions is a problem. I realised most people r not stingy, they just don't have. I don't want NYSC scrapped. it should be reformed. You meet people from all works of life.",Mon Apr 07 09:51:22 +0000 2025,0,0,en,53,False,False,0,0,,[],,53,0,False,True,1578,37016,,"It was weird. Bring money for small contributions is a problem. I realised most people r not stingy, they just don't have. I don't want NYSC scrapped. it should be reformed. You meet people from all works of life."
129,Digitalbimpe,https://t.co/cXnG8jk8zZ,digitalbimpe,Connect 👉,Thu Oct 29 08:07:00 +0000 2015,3112,2748,12804,109421,"Thank you and please subscribe as well 

God bless you 

I pray and hope they won’t approve the two years - one year is enough or they scrap Nysc",Sun Apr 06 21:23:35 +0000 2025,2,2,en,81,False,False,0,1,,[],,81,2,False,True,12804,109421,,"Thank you and please subscribe as well 

God bless you 

I pray and hope they won’t approve the two years - one year is enough or they scrap Nysc"
130,Ọdọfín M Abíọ́dún Oritsetsemayé,,OdofinMA,"Lagos, Nigeria",Tue Mar 19 11:53:34 +0000 2013,10334,172,3,20869,NYSC should be scrapped. It has lost its relevance.,Wed Jul 04 21:26:04 +0000 2018,454,413,en,,False,False,41,36,,[],,,454,False,True,3,20869,,NYSC should be scrapped. It has lost its relevance.
131,High Chief Okoro (SiR LaW),,HighChiefOkoro,,Tue Feb 18 08:19:05 +0000 2025,1562,517,463,3027,"Road accident and kidnapping has been taking the lives of Youth Corp Members day in and out.

What’s the purpose of NYSC in our current day Nigeria?

If NYSC can’t post Corp Members to their places of residence, they should scrap that useless program asap.",Sat Mar 22 21:51:40 +0000 2025,12,25,en,637,False,False,0,7,,[],,637,12,False,False,463,3027,,"Road accident and kidnapping has been taking the lives of Youth Corp Members day in and out.

What’s the purpose of NYSC in our current day Nigeria?

If NYSC can’t post Corp Members to their places of residence, they should scrap that useless program asap."
132,Naija,https://t.co/9vgVpPPFpC,Naija_PR,Nigeria,Tue Sep 24 18:00:41 +0000 2013,6809161,187462,180769,386262,Should nysc be scrapped or restructured? 👇,Sat Jul 21 11:50:51 +0000 2018,4,24,en,,True,False,8,30,,[],,,4,False,False,180769,386262,,Should nysc be scrapped or restructured? 👇
133,Abu bakar,https://t.co/jv9vHtOJCH,abbkar_ai,"Arewa,Nigeria",Tue Apr 07 21:55:33 +0000 2020,34478,575,7486,124481,"That Minister of Education who is proposing 2 years extention of NYSC program is talking from Beer parlor, It makes more sense to scrap NYSC and give the money to graduates to start Business.",Mon Apr 07 13:23:47 +0000 2025,3,16,en,585,False,False,0,0,,[],,585,3,False,True,7486,124481,,"That Minister of Education who is proposing 2 years extention of NYSC program is talking from Beer parlor, It makes more sense to scrap NYSC and give the money to graduates to start Business."
134,DIDARA,,Didara0,HOTEL REVERIE,Sun Nov 12 15:55:18 +0000 2023,1275,279,82,13752,"We’re clamoring for NYSC scrap, and this bitch wants an extension???!",Sun Apr 06 12:19:06 +0000 2025,1,5,en,210,False,False,0,0,,[],,210,1,False,True,82,13752,,"We’re clamoring for NYSC scrap, and this bitch wants an extension???!"
135,FitProf𓃵,,_fitprof,"Lagos, Nigeria",Mon May 25 09:57:15 +0000 2020,1709,262,451,31397,I still believe NYSC should be scrapped. It has no benefit to the students. Nysc has left students vulnerable to death and kidnapping. Nysc has made many students waste a full year. Nysc has destroyed relationships. Only people gaining from it are the tailors and contractors,Mon Mar 31 10:40:21 +0000 2025,0,0,en,60,False,False,0,0,,[],,60,0,False,True,451,31397,,I still believe NYSC should be scrapped. It has no benefit to the students. Nysc has left students vulnerable to death and kidnapping. Nysc has made many students waste a full year. Nysc has destroyed relationships. Only people gaining from it are the tailors and contractors
136,Al-Mustapha🕸️,,Al_Must3rph3r,"Katsina, Nigeria",Fri Feb 07 00:11:57 +0000 2020,3150,1854,186,127005,"Whoever is rejoicing with this proposal wallahi he don't have sense, his IQ is zero.
They spoiled ur career with strikes and delay ur life with spill over, after spending 6-7years on top 4years, and now you want to rejoice. They should scrap this NYSC give corpers the 1.8M for C.",Sat Apr 05 15:24:41 +0000 2025,1,7,en,431,False,False,1,3,,[],,431,1,False,True,186,127005,,"Whoever is rejoicing with this proposal wallahi he don't have sense, his IQ is zero.
They spoiled ur career with strikes and delay ur life with spill over, after spending 6-7years on top 4years, and now you want to rejoice. They should scrap this NYSC give corpers the 1.8M for C."
137,SOMTO 🇫🇷,,__Somto_,Everywhere ,Thu Aug 02 09:59:02 +0000 2012,30932,1867,3426,91480,"What if the Nigerian government limited NYSC to graduates with second class lower to first class honors and raised their monthly salaries to 200,000 Naira?

Would Nigerians support this idea? Would it encourage harder studying, or should the program be scrapped entirely? 🤔",Mon Mar 24 13:18:16 +0000 2025,14,24,en,2168,True,False,0,9,,[],,2168,14,False,True,3426,91480,,"What if the Nigerian government limited NYSC to graduates with second class lower to first class honors and raised their monthly salaries to 200,000 Naira?

Would Nigerians support this idea? Would it encourage harder studying, or should the program be scrapped entirely? 🤔"
138,AyòÌféolúwa💎🌱||,https://t.co/9T4gjpKs2k,PenNPlogs,"Ilorin, Nigeria",Sun Jun 05 13:15:30 +0000 2022,177,287,339,10077,"Haaa.
I will miss Ploggas convention ke?😭😭
Scrap NYSC right now!
This scheme is fraud mehn.🤧
#CancelNYSC",Tue Apr 15 21:30:30 +0000 2025,0,0,en,65,False,False,0,0,,['CancelNYSC'],,65,0,False,False,339,10077,,"Haaa.
I will miss Ploggas convention ke?😭😭
Scrap NYSC right now!
This scheme is fraud mehn.🤧
#CancelNYSC"
139,Eddy 247🎭,https://t.co/raL4zSAIpZ,Eddy247_,Nigeria,Tue Sep 03 00:37:25 +0000 2019,48017,1615,5509,30005,They should scrap university instead and let NYSC be 10 years mumu county.,Sat Apr 05 16:01:44 +0000 2025,1,8,en,866,False,False,0,1,,[],,866,1,False,True,5509,30005,,They should scrap university instead and let NYSC be 10 years mumu county.
140,Barokah🤲🏿,,opeyemisphasy,"Ibadan, Nigeria",Wed Jan 03 00:58:27 +0000 2018,1840,1090,413,7577,"I need to know our government official’s dealers. Things would be going south in the country and their thoughts are always towards underground directions. We’re hoping NYSC got scrapped, they’re thinking of increasing it to 2yrs😂. 

What a country😒!!",Sat Apr 05 21:46:15 +0000 2025,0,7,en,389,False,False,0,1,,[],,389,0,False,True,413,7577,,"I need to know our government official’s dealers. Things would be going south in the country and their thoughts are always towards underground directions. We’re hoping NYSC got scrapped, they’re thinking of increasing it to 2yrs😂. 

What a country😒!!"
141,Bunmi,,olubunmi_J,Within,Sat Jun 04 17:11:17 +0000 2022,1720,1285,2314,49275,"This posting of Yorùbá youngsters out if their homeland  to undeveloped parts of Nigeria to go &amp; serve their ""fatherland"" while others are posted to Yorubaland to enjoy the development birthed by hard work of Yoruba leaders is just totally unfair. This NYSC needs to be scrapped.",Mon Mar 17 14:41:01 +0000 2025,0,5,en,104,False,False,0,0,,[],,104,0,False,True,2314,49275,,"This posting of Yorùbá youngsters out if their homeland  to undeveloped parts of Nigeria to go &amp; serve their ""fatherland"" while others are posted to Yorubaland to enjoy the development birthed by hard work of Yoruba leaders is just totally unfair. This NYSC needs to be scrapped."
142,Checkmate🗨,,6tusss,Earth,Thu Jan 06 12:00:59 +0000 2022,142,466,94,2452,"These guys still don't want to meet our demand that NYSC must be scrapped.
There is something happening behind the scene that we don't know.
Hmmmmmm",Fri Mar 21 12:57:58 +0000 2025,0,0,en,165,False,False,0,0,,[],,165,0,False,False,94,2452,,"These guys still don't want to meet our demand that NYSC must be scrapped.
There is something happening behind the scene that we don't know.
Hmmmmmm"
143,JUSTICE!,,Emekaelenwoke,"Lagos, Nigeria",Sun Jun 20 16:45:44 +0000 2010,5038,1905,919,42064,"LET ME MAKE MYSELF CLEAR AGAIN:

IN MY CANDID OPINION,NYSC SHOULD BE SCRAPPED!

THE MAJOR REASON IT WAS FOUNDED IN THE FIRST PLACE, “NATIONAL INTEGRATION” HAS FAILED SHAMEFULLY &amp; WOEFULLY! 

LET US THEREFORE STOP AND END THE WASTE OF RESOURCES, RISK AND 365?DAYS OF PRECIOUS TIME!",Tue Mar 18 12:08:54 +0000 2025,0,1,en,82,True,False,0,0,,[],,82,0,False,False,919,42064,,"LET ME MAKE MYSELF CLEAR AGAIN:

IN MY CANDID OPINION,NYSC SHOULD BE SCRAPPED!

THE MAJOR REASON IT WAS FOUNDED IN THE FIRST PLACE, “NATIONAL INTEGRATION” HAS FAILED SHAMEFULLY &amp; WOEFULLY! 

LET US THEREFORE STOP AND END THE WASTE OF RESOURCES, RISK AND 365?DAYS OF PRECIOUS TIME!"
144,XL2LETTERS,,XL2LETTERS,"Edmonton, Alberta",Tue Dec 29 15:29:53 +0000 2009,4438,5035,7284,352655,"#30daysrantchallenge

SEE LEFT TO ME, NYSC NEEDS TO BE SCRAPPED! HOW MANY GRADUATES MUST SUFFER?! HOW MANY HAVE TO DIE BEFORE IT IS REMOVED?! 

HOW MANY SCHOOLS KEEP USING NYSC CORPERS INSTEAD OF EMPLOYING PROPER TEACHERS?! 

#BOYCOTTNYSC",Mon Mar 17 22:53:23 +0000 2025,0,0,en,102,False,False,0,0,,"['30daysrantchallenge', 'BOYCOTTNYSC']",,102,0,False,True,7284,352655,,"#30daysrantchallenge

SEE LEFT TO ME, NYSC NEEDS TO BE SCRAPPED! HOW MANY GRADUATES MUST SUFFER?! HOW MANY HAVE TO DIE BEFORE IT IS REMOVED?! 

HOW MANY SCHOOLS KEEP USING NYSC CORPERS INSTEAD OF EMPLOYING PROPER TEACHERS?! 

#BOYCOTTNYSC"
145,Fadrex,,Broke_Fadrex,,Sat Feb 26 09:11:43 +0000 2022,236,649,589,8325,"Make dem no scrap any NYSC again

All of una gatz suffer wetin I suffer abeg",Tue Mar 18 17:55:08 +0000 2025,2,9,en,348,False,False,1,2,,[],,348,2,False,True,589,8325,,"Make dem no scrap any NYSC again

All of una gatz suffer wetin I suffer abeg"
146,JK,https://t.co/AYH2aEMfhb,JohnKolawole20,"Lagos, Nigeria",Tue Apr 26 16:19:38 +0000 2011,1184,878,367,6616,"NYSC must be scrapped 
It has no usefulness. Let everyone go and serve in there state that is not smelling. @jidesanwoolu @officialABAT @officialnyscng",Mon Mar 17 15:50:30 +0000 2025,0,0,en,44,False,False,0,0,,[],,44,0,False,True,367,6616,,"NYSC must be scrapped 
It has no usefulness. Let everyone go and serve in there state that is not smelling. @jidesanwoolu @officialABAT @officialnyscng"
147,Punch Newspapers,https://t.co/JwPtwCGMPv,MobilePunch,"Lagos, Nigeria",Sat Mar 14 00:27:10 +0000 2009,6993201,2109,117257,713297,Why NYSC should not be scrapped – Don https://t.co/ITBxHWlW4H https://t.co/zZ1q1Yek7I,Wed Dec 07 15:32:56 +0000 2016,4,5,en,,True,False,0,1,,[],False,,4,False,False,117257,713297,"[{'display_url': 'pic.x.com/zZ1q1Yek7I', 'expanded_url': 'https://x.com/MobilePunch/status/806521885857030145/photo/1', 'id_str': '806521845516304384', 'indices': [62, 85], 'media_key': '3_806521845516304384', 'media_url_https': 'https://pbs.twimg.com/media/CzFXWGmXgAAW8PS.jpg', 'type': 'photo', 'url': 'https://t.co/zZ1q1Yek7I', 'ext_media_availability': {'status': 'Available'}, 'features': {'large': {'faces': [{'x': 204, 'y': 122, 'h': 36, 'w': 36}, {'x': 519, 'y': 157, 'h': 52, 'w': 52}]}, 'medium': {'faces': [{'x': 204, 'y': 122, 'h': 36, 'w': 36}, {'x': 519, 'y': 157, 'h': 52, 'w': 52}]}, 'small': {'faces': [{'x': 204, 'y': 122, 'h': 36, 'w': 36}, {'x': 519, 'y': 157, 'h': 52, 'w': 52}]}, 'orig': {'faces': [{'x': 204, 'y': 122, 'h': 36, 'w': 36}, {'x': 519, 'y': 157, 'h': 52, 'w': 52}]}}, 'sizes': {'large': {'h': 315, 'w': 600, 'resize': 'fit'}, 'medium': {'h': 315, 'w': 600, 'resize': 'fit'}, 'small': {'h': 315, 'w': 600, 'resize': 'fit'}, 'thumb': {'h': 150, 'w': 150, 'resize': 'crop'}}, 'original_info': {'height': 315, 'width': 600, 'focus_rects': []}, 'media_results': {'result': {'media_key': '3_806521845516304384'}}}]",Why NYSC should not be scrapped – Don https://t.co/ITBxHWlW4H https://t.co/zZ1q1Yek7I
148,Punch Newspapers,https://t.co/JwPtwCGMPv,MobilePunch,"Lagos, Nigeria",Sat Mar 14 00:27:10 +0000 2009,6993201,2109,117257,713297,"50 years on, reform or scrap NYSC
https://t.co/zf7SNNMMaN",Wed Jun 07 09:38:53 +0000 2023,27,266,en,47597,True,False,2,71,,[],False,47597,27,False,False,117257,713297,,"50 years on, reform or scrap NYSC
https://t.co/zf7SNNMMaN"
149,Ainà Dipo 🇳🇬,https://t.co/gnuGQaNRJk,dipoaina1,Nigeria,Wed Jan 19 15:57:00 +0000 2022,42623,3320,18561,58002,"Replace it with 1 year compulsory military service.

Scrap that NYSC immediately 😔",Tue Apr 08 19:31:27 +0000 2025,0,0,en,647,True,False,0,0,,[],,647,0,False,True,18561,58002,,"Replace it with 1 year compulsory military service.

Scrap that NYSC immediately 😔"
150,iDAN 🦸🏽,https://t.co/KxDt342SwN,dangbanamanager,The Islamic Republic of Iran ,Wed Jan 13 08:15:37 +0000 2021,19547,9057,5387,175770,"The NYSC program is essentially cheap labor. By the end of the year, most participants spend more than they earn. Makes no sense and should be stopped immediately.",Thu Feb 27 04:34:51 +0000 2025,103,294,en,7527,True,False,5,13,,[],,7527,103,False,True,5387,175770,,"The NYSC program is essentially cheap labor. By the end of the year, most participants spend more than they earn. Makes no sense and should be stopped immediately."
151,Ebuka,https://t.co/bIVUCJ4mOq,ebuka_mic,"Lagos, Nigeria",Sun Aug 01 20:44:41 +0000 2010,7647,1675,568,28911,"Lol these guys 😂.
I hope you know that Osun, Ekiti, Ogun and other SW states are also non-indigenous to Lagos. 
Let every man face his or her state then and scrap the whole NYSC because this tweet defeats the very purpose of the scheme.",Mon Mar 17 15:12:53 +0000 2025,0,4,en,362,False,False,0,0,,[],,362,0,False,True,568,28911,,"Lol these guys 😂.
I hope you know that Osun, Ekiti, Ogun and other SW states are also non-indigenous to Lagos. 
Let every man face his or her state then and scrap the whole NYSC because this tweet defeats the very purpose of the scheme."
