176,Obafemi Awolowo (Parody of The Sage)🐐,https://t.co/ziAon2f5XC,TalkSpotNigeria,Africa,Fri Sep 14 10:56:44 +0000 2012,1497,3084,307,27062,@Omoluabiododo We are still ranting. But the moment we chose to speak with one voice the house will shake. NYSC should be scrapped if it can't be restructured just like Nigeria needs restructuring. You can't be posting Yoruba to underdeveloped region and deprive them of economics opportunities.,Sat Apr 12 05:41:51 +0000 2025,2,11,en,407,False,False,0,1,,[],,407,2,False,False,307,27062,,@Omoluabiododo We are still ranting. But the moment we chose to speak with one voice the house will shake. NYSC should be scrapped if it can't be restructured just like Nigeria needs restructuring. You can't be posting Yoruba to underdeveloped region and deprive them of economics opportunities.
177,Punch Newspapers,https://t.co/JwPtwCGMPv,MobilePunch,"Lagos, Nigeria",Sat Mar 14 00:27:10 +0000 2009,6993203,2109,117257,713297,"'NYSC is Nigeria's only legacy of unity, don't scrap it' - Punch Newspapers https://t.co/mTMrW32Ue3",Tue May 25 15:00:28 +0000 2021,30,171,en,,True,False,13,88,,[],False,,30,False,False,117257,713297,,"'NYSC is Nigeria's only legacy of unity, don't scrap it' - Punch Newspapers https://t.co/mTMrW32Ue3"
178,Ndi Kato (indicator),https://t.co/psNCFeQDsN,YarKafanchan,"Abuja, Nigeria",Fri Jun 05 11:10:18 +0000 2009,169837,1676,13518,418629,"One Nigerian president needs to have the guts to shut down NYSC; it has outlived its usefulness and it poses concrete danger to Nigerian youth. Scrap NYSC; it is not only useless, it endangers our youth.",Sun Mar 16 17:12:16 +0000 2025,135,348,en,7932,False,False,4,14,,[],,7932,135,False,True,13518,418629,,"One Nigerian president needs to have the guts to shut down NYSC; it has outlived its usefulness and it poses concrete danger to Nigerian youth. Scrap NYSC; it is not only useless, it endangers our youth."
179,Fred Nwaozor☆,https://t.co/qOKh1m2SAe,mediambassador,Nigeria,Sun Nov 29 12:40:23 +0000 2015,61,4,208,3275,"At a time Nigerians are clamouring for the NYSC to be outrightly scrapped from the country’s education system, some government officials are busy lobbying for extension of its duration. How do you reconcile this? ""One man's food is another man's poison.""
https://t.co/BrYrCfd72m",Mon Apr 07 14:12:09 +0000 2025,0,0,en,92,False,False,0,0,,[],False,92,0,False,True,208,3275,,"At a time Nigerians are clamouring for the NYSC to be outrightly scrapped from the country’s education system, some government officials are busy lobbying for extension of its duration. How do you reconcile this? ""One man's food is another man's poison.""
https://t.co/BrYrCfd72m"
180,k.o.a.,,KobinnaA,,Mon May 11 17:03:13 +0000 2020,2178,183,2715,26900,"@CollinsEkwenug1 @DeleFarotimi Degree/Higher National Diploma from an accredited program, at the time of graduation. Make the completion of NYSC compulsory, until it is scrapped for the rest of the citizens. #ScrapNYSCnow.",Thu Apr 17 19:06:43 +0000 2025,0,2,en,55,False,False,0,1,,['ScrapNYSCnow'],,55,0,False,False,2715,26900,,"@CollinsEkwenug1 @DeleFarotimi Degree/Higher National Diploma from an accredited program, at the time of graduation. Make the completion of NYSC compulsory, until it is scrapped for the rest of the citizens. #ScrapNYSCnow."
181,Naija,https://t.co/9vgVpPPFpC,Naija_PR,Nigeria,Tue Sep 24 18:00:41 +0000 2013,6809161,187462,180770,386263,"NYSC is Nigeria's only legacy of unity, don't scrap it -- Civil rights advocacy group",Tue May 25 15:40:25 +0000 2021,16,122,en,,True,False,5,18,,[],,,16,False,False,180770,386263,,"NYSC is Nigeria's only legacy of unity, don't scrap it -- Civil rights advocacy group"
182,Red,,notsahmy,inside,Wed Jun 06 02:46:05 +0000 2018,786,1520,1085,38773,"The day they scrap this NYSC, many schools will suffer. Most schools now depend on corpers for teaching",Wed Apr 02 12:44:51 +0000 2025,0,3,en,256,False,False,1,1,,[],,256,0,False,False,1085,38773,,"The day they scrap this NYSC, many schools will suffer. Most schools now depend on corpers for teaching"
183,Legend Crypto ™,,99___farooq,"Kaduna, Nigeria",Sun Mar 02 05:33:51 +0000 2014,672,1219,579,7880,This is printed and given to every corps member. Why are they mandating NYSC and threatening corpers. They can't even guarantee their security. Scrapped it now. #NYSC #NYSCREFORMS #Sowore #RevolutionNow https://t.co/3QHrPxFFon,Tue Mar 18 12:31:24 +0000 2025,0,0,en,26,False,False,0,0,,"['NYSC', 'NYSCREFORMS', 'Sowore', 'RevolutionNow']",False,26,0,False,True,579,7880,"[{'display_url': 'pic.x.com/3QHrPxFFon', 'expanded_url': 'https://x.com/99___farooq/status/1901974718887936029/photo/1', 'id_str': '1901974703998488576', 'indices': [203, 226], 'media_key': '3_1901974703998488576', 'media_url_https': 'https://pbs.twimg.com/media/GmUr6oub0AAZBLo.jpg', 'type': 'photo', 'url': 'https://t.co/3QHrPxFFon', 'ext_media_availability': {'status': 'Available'}, 'features': {'all': {'tags': [{'user_id': '1087778780', 'name': 'ARISE NEWS', 'screen_name': 'ARISEtv', 'type': 'user'}, {'user_id': '1264939901755240449', 'name': 'Arewa Twiter Connect', 'screen_name': 'ArewaaConnect', 'type': 'user'}, {'user_id': '1687822884', 'name': 'Channels Sports', 'screen_name': 'channels_sports', 'type': 'user'}, {'user_id': '2769777936', 'name': 'TVC News', 'screen_name': 'tvcnewsng', 'type': 'user'}]}, 'large': {'faces': []}, 'medium': {'faces': []}, 'small': {'faces': []}, 'orig': {'faces': []}}, 'sizes': {'large': {'h': 372, 'w': 720, 'resize': 'fit'}, 'medium': {'h': 372, 'w': 720, 'resize': 'fit'}, 'small': {'h': 351, 'w': 680, 'resize': 'fit'}, 'thumb': {'h': 150, 'w': 150, 'resize': 'crop'}}, 'original_info': {'height': 372, 'width': 720, 'focus_rects': [{'x': 0, 'y': 0, 'w': 664, 'h': 372}, {'x': 12, 'y': 0, 'w': 372, 'h': 372}, {'x': 35, 'y': 0, 'w': 326, 'h': 372}, {'x': 105, 'y': 0, 'w': 186, 'h': 372}, {'x': 0, 'y': 0, 'w': 720, 'h': 372}]}, 'media_results': {'result': {'media_key': '3_1901974703998488576'}}}]",This is printed and given to every corps member. Why are they mandating NYSC and threatening corpers. They can't even guarantee their security. Scrapped it now. #NYSC #NYSCREFORMS #Sowore #RevolutionNow https://t.co/3QHrPxFFon
184,Amourab,,amourab,"St. John's, Newfoundland and L",Tue Feb 06 15:27:14 +0000 2018,16676,13798,2238,37655,"@Uyaiabasi19 This is disheartening. I think NYSC should be scrapped. It has outgrown its usefulness. 

May God help your sister.",Fri Aug 18 22:34:19 +0000 2023,20,296,en,32013,True,False,4,14,,[],,32013,20,False,True,2238,37655,,"@Uyaiabasi19 This is disheartening. I think NYSC should be scrapped. It has outgrown its usefulness. 

May God help your sister."
185,SHEYI TECH PHONES & GADGETS,https://t.co/SfaVCp8NPM,_SheyiTech,Computer village ikeja ,Fri Mar 09 12:27:29 +0000 2012,1700,1572,452,19842,"@femiakande60 @wandyvirus Ijero local government

And people want NYSC scrapped 

How will I know these beautiful places if not for they scheme",Fri Mar 21 17:43:05 +0000 2025,0,1,en,50,False,False,0,0,,[],,50,0,False,True,452,19842,,"@femiakande60 @wandyvirus Ijero local government

And people want NYSC scrapped 

How will I know these beautiful places if not for they scheme"
186,Morris Monye,https://t.co/BGzn3RwsXq,Morris_Monye,"Abuja, Nigeria",Fri Jun 10 13:24:34 +0000 2016,427050,36955,8393,136253,BREAKING: House of Reps deliberate scrapping of NYSC permanently.,Mon May 24 18:04:16 +0000 2021,663,2535,en,,True,False,201,283,,[],,,663,False,True,8393,136253,,BREAKING: House of Reps deliberate scrapping of NYSC permanently.
187,Punch Newspapers,https://t.co/JwPtwCGMPv,MobilePunch,"Lagos, Nigeria",Sat Mar 14 00:27:10 +0000 2009,6993204,2109,117257,713297,"Nigeria more united when NYSC was established than now –Abiante, sponsor of bill to scrap scheme - Punch Newspapers https://t.co/mp3S2eP7EE",Sun May 30 07:36:08 +0000 2021,12,79,en,,True,False,2,13,,[],False,,12,False,False,117257,713297,,"Nigeria more united when NYSC was established than now –Abiante, sponsor of bill to scrap scheme - Punch Newspapers https://t.co/mp3S2eP7EE"
188,Punch Newspapers,https://t.co/JwPtwCGMPv,MobilePunch,"Lagos, Nigeria",Sat Mar 14 00:27:10 +0000 2009,6993204,2109,117257,713297,"We won’t scrap NYSC, says FG https://t.co/jvkQuwYb3a",Wed Jan 06 00:14:04 +0000 2016,9,2,en,,True,False,0,0,,[],False,,9,False,False,117257,713297,,"We won’t scrap NYSC, says FG https://t.co/jvkQuwYb3a"
189,Punch Newspapers,https://t.co/JwPtwCGMPv,MobilePunch,"Lagos, Nigeria",Sat Mar 14 00:27:10 +0000 2009,6993204,2109,117257,713297,Why NYSC should not be scrapped – Don https://t.co/ITBxHWlW4H,Wed Dec 07 14:26:01 +0000 2016,6,5,en,,True,False,0,0,,[],False,,6,False,False,117257,713297,,Why NYSC should not be scrapped – Don https://t.co/ITBxHWlW4H
190,SKALES,https://t.co/lfFUs1aJ5X,youngskales,,Wed Oct 07 14:07:49 +0000 2009,802733,1833,3129,87673,It’s time to scrap @officialnyscng … very useless and pointless … this is 2025 … @officialABAT … the economy is too bad to continue spending on nysc,Mon Mar 17 14:35:14 +0000 2025,170,503,en,13163,True,False,3,49,,[],,13163,170,False,False,3129,87673,,It’s time to scrap @officialnyscng … very useless and pointless … this is 2025 … @officialABAT … the economy is too bad to continue spending on nysc
191,Isioro-Emamezi Murphy,https://t.co/BtoQwosw7A,emamezimurphy,"Lagos, Ghana, Kenya",Fri Aug 31 01:04:38 +0000 2012,1108,926,966,18805,"National Youth Service Corps (NYSC) has lost its savour and essence. Maybe it should be SCRAPPED or redressed not because of 77K.

It is my firm thinking that the scheme or programme is only alive because elder statesman, Gen Yakubu Gowon (Rtd) is still alive.",Sat Apr 05 20:28:26 +0000 2025,2,1,en,237,False,False,0,0,,[],,237,2,False,True,966,18805,,"National Youth Service Corps (NYSC) has lost its savour and essence. Maybe it should be SCRAPPED or redressed not because of 77K.

It is my firm thinking that the scheme or programme is only alive because elder statesman, Gen Yakubu Gowon (Rtd) is still alive."
192,Chris Ejiofor 𝕏,,ChrisEjiofor7, 🇳🇬🇨🇦 ,Thu Feb 24 10:34:50 +0000 2022,14669,2966,3143,143965,"@DanielRegha If you make NYSC optional, the purpose of its establishment has been defeated. I suggest a total scrapping or it should be left alone but reformed to better offer a better life to the corners and an allowance of at least 200k per month.",Sat Mar 15 22:25:00 +0000 2025,0,410,en,38405,True,False,1,17,,[],,38405,0,False,True,3143,143965,,"@DanielRegha If you make NYSC optional, the purpose of its establishment has been defeated. I suggest a total scrapping or it should be left alone but reformed to better offer a better life to the corners and an allowance of at least 200k per month."
193,IRUNNIA,https://t.co/nNnVTESfux,Irunnia_,Turn On My Notifications ,Sun Jul 29 11:40:48 +0000 2018,375923,13367,13050,277596,I still stand by what I said. NYSC should be scrapped. The insecurity in the country is too much to be sending people to places they're not familiar with.,Thu Sep 23 22:17:53 +0000 2021,55,220,en,,True,False,2,6,,[],,,55,False,True,13050,277596,,I still stand by what I said. NYSC should be scrapped. The insecurity in the country is too much to be sending people to places they're not familiar with.
194,Ubon,,Nattie_Best,"Uyo, Nigeria",Fri Jan 21 13:39:52 +0000 2011,3297,1444,4542,580468,"A protest to scrap NYSC would be very interesting. No need to hit the streets, so no risk of gunshots. The SUG presidents and NANS would simply rally all final year students to desist from NYSC registration. The FG will do shakara at first, but after 18 months, NYSC will be gone.",Sat Apr 05 14:35:09 +0000 2025,0,2,en,429,False,False,0,2,,[],,429,0,False,True,4542,580468,,"A protest to scrap NYSC would be very interesting. No need to hit the streets, so no risk of gunshots. The SUG presidents and NANS would simply rally all final year students to desist from NYSC registration. The FG will do shakara at first, but after 18 months, NYSC will be gone."
195,Olúwafẹ́mi👑❤️🚀,,TheFemog,,Fri Dec 01 13:45:44 +0000 2023,494,899,280,6134,"""NYSC should be scrapped, it doesn't make any sense""

Says Suraju who attended Imukoro Development Community High School, Gwalada. And he knows the great impact one corper that was posted to his school had in his life.

You lots are jokers fr.
Most Genzs and sense. 🫲🏼🫱🏼",Mon Mar 17 14:35:19 +0000 2025,1,6,en,190,False,False,1,0,,[],,190,1,False,False,280,6134,,"""NYSC should be scrapped, it doesn't make any sense""

Says Suraju who attended Imukoro Development Community High School, Gwalada. And he knows the great impact one corper that was posted to his school had in his life.

You lots are jokers fr.
Most Genzs and sense. 🫲🏼🫱🏼"
196,DaVinci Engr👷🌍,https://t.co/xFB5pIMNQ1,edunnewi,Earth,Fri Sep 08 22:50:40 +0000 2023,2042,2065,1018,14218,"Many Nigerian youths that shouted ""scrap NYSC!"" in the past have lost their voices because of ₦77k.
Poverty is togzik!☹️",Thu Apr 03 19:38:39 +0000 2025,0,4,en,439,False,False,0,0,"<Place id=""01aca86a155c9099"" name=""Enugu"">",[],,439,0,False,True,1018,14218,,"Many Nigerian youths that shouted ""scrap NYSC!"" in the past have lost their voices because of ₦77k.
Poverty is togzik!☹️"
197,Dr Dípò Awójídé,https://t.co/8XWrEvZukF,OgbeniDipo,England,Tue Jun 08 20:08:14 +0000 2010,1217588,3684,4531,149129,"If NYSC will be scrapped, it should be replaced with an internship or a placement year in the penultimate year. 70% of students should have the opportunity to undergo this placement or internship before graduating. I really hope they think this one through before proceeding.",Mon May 24 22:40:51 +0000 2021,142,633,en,,True,False,6,23,,[],,,142,False,False,4531,149129,,"If NYSC will be scrapped, it should be replaced with an internship or a placement year in the penultimate year. 70% of students should have the opportunity to undergo this placement or internship before graduating. I really hope they think this one through before proceeding."
198,SizZzle. 😎🇳🇬,,n6oflife6,"Manhattan, NY",Tue Nov 05 21:57:26 +0000 2019,45547,1535,456,41578,"Scrap the NYSC program entirely.
It has Outlived its Relevance. 

My suggestion is; 

Once you finish University the Govt should calculate the current Monthly NYSC allowance, multiply it by 12 months and Credit every Uni Graduate to start an SME. 😎

Bin everything Else. 🚮😤🇳🇬",Tue Jan 21 20:15:23 +0000 2025,303,1054,en,37133,False,False,18,62,,[],,37133,303,False,True,456,41578,,"Scrap the NYSC program entirely.
It has Outlived its Relevance. 

My suggestion is; 

Once you finish University the Govt should calculate the current Monthly NYSC allowance, multiply it by 12 months and Credit every Uni Graduate to start an SME. 😎

Bin everything Else. 🚮😤🇳🇬"
199,Man of Letters.,,Letter_to_Jack,,Sat May 30 05:54:59 +0000 2020,344304,1911,11551,346132,"What do you guys think about the news that from next year (2025), NYSC will be scrapped and every Nigerian graduate below 30 years old must now serve two years in the military before applying for any job?",Mon Apr 01 08:31:10 +0000 2024,36,238,en,53424,True,False,24,63,,[],,53424,36,False,True,11551,346132,,"What do you guys think about the news that from next year (2025), NYSC will be scrapped and every Nigerian graduate below 30 years old must now serve two years in the military before applying for any job?"
200,DAMOLA 🏀⚽️ ⚾️🔞,https://t.co/zZ5nRzbNcV,holardamolar,Close.,Thu Sep 27 22:50:05 +0000 2018,208436,9155,11906,269173,"80% of the members gets to be away from their family for a year to a strange land with high volume of risk 

90% goes back to being jobless immediately after the program

Annual salary of the NYSC program is less than N400k;  2 months into the program,  with proper managing,",Sun Mar 16 08:17:59 +0000 2025,102,274,en,15382,True,False,5,19,,[],,15382,102,False,True,11906,269173,,"80% of the members gets to be away from their family for a year to a strange land with high volume of risk 

90% goes back to being jobless immediately after the program

Annual salary of the NYSC program is less than N400k;  2 months into the program,  with proper managing, there is no way you haven't spent N700k on settling down(you are not in lagos, Abuja and the likes)

How is a scheme like this even acceptable? If it can't be properly  reformed, it should be scrapped. Looks like a Proper waste of one's 1 year."
201,@𝗼𝗻𝗲𝗷𝗼𝗯𝗹𝗲𝘀𝘀𝗯𝗼𝘆,https://t.co/0KfRLplOVE,OneJoblessBoy,,Sat Dec 26 05:16:09 +0000 2015,280436,12368,71297,148541,"""NYSC has outlived its usefulness...""

Discuss (30 marks)",Sat Mar 15 17:01:27 +0000 2025,76,440,en,22202,True,False,10,26,,[],,22202,76,False,True,71297,148541,,"""NYSC has outlived its usefulness...""

Discuss (30 marks)"
202,Samuel Ajayi 🇳🇬🗣️🌐,,SamdGreat01,"Florida, USA",Thu Mar 26 18:02:05 +0000 2015,200523,1129,4486,65025,Now NYSC certificate not mandatory for public office but mandatory for a 30k job,Wed Jul 07 12:46:53 +0000 2021,157,556,en,,True,False,15,33,,[],,,157,False,True,4486,65025,,Now NYSC certificate not mandatory for public office but mandatory for a 30k job
203,Abdulsalam M. Nuhu,https://t.co/3b8O2RtY1Z,salamnuhu,"Jalingo, Nigeria",Thu Jan 05 14:25:21 +0000 2012,5289,2159,506,53401,"@drSadiqabdool Doctors cannot be exempted. They are also graduates, just like all others. Unless NYSC is scrapped, every graduate who doubles as a graduate will do it. Make peace with it already.😂",Sun Mar 30 11:38:20 +0000 2025,0,0,en,30,False,False,0,1,,[],,30,0,False,True,506,53401,,"@drSadiqabdool Doctors cannot be exempted. They are also graduates, just like all others. Unless NYSC is scrapped, every graduate who doubles as a graduate will do it. Make peace with it already.😂"
204,Former Sureboy⭐️,,IgonorMathias,"Atlanta, GA",Wed Oct 21 18:45:20 +0000 2020,22541,997,1430,13510,Scrap NYSC today 😭,Sat Apr 05 14:17:37 +0000 2025,0,2,en,408,True,False,0,0,,[],,408,0,False,True,1430,13510,,Scrap NYSC today 😭
205,SizZzle. 😎🇳🇬,,n6oflife6,"Manhattan, NY",Tue Nov 05 21:57:26 +0000 2019,45547,1535,456,41578,"Democracy is Government of The People, For the People &amp; By the People. 

The People say they are Tired of NYSC &amp; that it should be Scrapped or Remodeled. APC today is Proposing Extending NYSC to 2 years. 

Shey na Democracy we still dey Practice for Nigeria Abi na Another Tin? 🙄",Sat Apr 05 16:20:53 +0000 2025,266,596,en,9675,False,False,0,29,,[],,9675,266,False,True,456,41578,,"Democracy is Government of The People, For the People &amp; By the People. 

The People say they are Tired of NYSC &amp; that it should be Scrapped or Remodeled. APC today is Proposing Extending NYSC to 2 years. 

Shey na Democracy we still dey Practice for Nigeria Abi na Another Tin? 🙄"
206,Tunde,https://t.co/ONTUacWM79,Tundeiness,Around you,Wed May 06 10:41:56 +0000 2009,1573,863,1895,66690,"When it is ""scrapped"", oga NYSC DG will not be informed. He will just go back to their barracks.",Fri Apr 04 17:24:36 +0000 2025,0,0,en,52,False,False,0,0,,[],,52,0,False,False,1895,66690,,"When it is ""scrapped"", oga NYSC DG will not be informed. He will just go back to their barracks."
207,Ehironome,https://t.co/g0c9GMzNJw,slimnome,"Lagos, Nigeria",Mon Mar 25 08:59:09 +0000 2024,309,280,67,1542,NYSC no be so oo😂 wanted to escape from this house but NYSC said no till the next batch 🙂‍↔️,Mon Apr 14 09:48:52 +0000 2025,0,2,en,73,False,False,0,0,,[],,73,0,False,True,67,1542,,NYSC no be so oo😂 wanted to escape from this house but NYSC said no till the next batch 🙂‍↔️
208,Toyosi Godwin,https://t.co/4TLFYW66Up,ToyosiGodwin,,Sun Dec 04 13:54:40 +0000 2016,121407,11482,10334,232349,"I don't think NYSC should be scrapped. It can be modified. Last week, I met someone with 200 #BnB. He explained crypto to me again. Networking.

There are digital skill enthusiasts willing to teach for free here. This is literally an opportunity to encourage youths embracing tech",Tue May 25 10:29:34 +0000 2021,61,242,en,,False,False,2,11,,['BnB'],,,61,False,True,10334,232349,,"I don't think NYSC should be scrapped. It can be modified. Last week, I met someone with 200 #BnB. He explained crypto to me again. Networking.

There are digital skill enthusiasts willing to teach for free here. This is literally an opportunity to encourage youths embracing tech"
209,The Republic,https://t.co/PZzO4rj0L5,republicjournal,"Victoria Island, Nigeria",Mon Jul 13 01:36:41 +0000 2015,25362,68,5358,48905,"NYSC began as a conciliatory post-war programme aimed at nation-building. But it has been reduced to a drafting system with terrible consequences on young people and Nigeria’s finances. 

It’s time to end the programme.
https://t.co/gJlFW2Ior2",Sun Mar 16 10:37:31 +0000 2025,455,658,en,25919,True,False,20,5,,[],False,25919,455,False,True,5358,48905,,"NYSC began as a conciliatory post-war programme aimed at nation-building. But it has been reduced to a drafting system with terrible consequences on young people and Nigeria’s finances. 

It’s time to end the programme.
https://t.co/gJlFW2Ior2"
210,Rola,https://t.co/LfoOniv8lL,kofoworola__a,,Sun Jan 28 22:49:43 +0000 2018,52658,2759,9412,508510,"Nysc is not worth risking your life for. First of all they will send you to 3 weeks camp that is irrelevant, just suffer and waking up by 3am. 

It’s easy for everyone to say why didn’t you do direct posting? How many people can afford 100k to get Lagos??
Nysc should be scrapped",Sun Jan 14 08:48:21 +0000 2024,58,246,en,15351,True,False,3,13,,[],,15351,58,False,True,9412,508510,,"Nysc is not worth risking your life for. First of all they will send you to 3 weeks camp that is irrelevant, just suffer and waking up by 3am. 

It’s easy for everyone to say why didn’t you do direct posting? How many people can afford 100k to get Lagos??
Nysc should be scrapped"
211,Naija,https://t.co/9vgVpPPFpC,Naija_PR,Nigeria,Tue Sep 24 18:00:41 +0000 2013,6809161,187462,180770,386263,House of Representatives is considering discontinuing the NYSC scheme,Mon May 24 13:59:10 +0000 2021,713,3410,en,,True,False,284,307,,[],,,713,False,False,180770,386263,,House of Representatives is considering discontinuing the NYSC scheme
212,DisTrackers,https://t.co/U9iDwdOdUr,DisTrackers,United States,Sun Jan 16 05:54:02 +0000 2011,95209,190,53208,132283,NYCC has been canceled. Virtual Con will be the way. https://t.co/cPmGXvmw1G,Tue Aug 11 17:19:44 +0000 2020,28,163,en,,True,False,9,43,,[],False,,28,False,True,53208,132283,"[{'display_url': 'pic.x.com/cPmGXvmw1G', 'expanded_url': 'https://x.com/DisFunko/status/1293235665828642816/photo/1', 'id_str': '1293235662418673664', 'indices': [53, 76], 'media_key': '3_1293235662418673664', 'media_url_https': 'https://pbs.twimg.com/media/EfJ--61VAAARKVO.jpg', 'type': 'photo', 'url': 'https://t.co/cPmGXvmw1G', 'ext_media_availability': {'status': 'Available'}, 'features': {'large': {'faces': [{'x': 225, 'y': 1023, 'h': 259, 'w': 259}]}, 'medium': {'faces': [{'x': 169, 'y': 770, 'h': 195, 'w': 195}]}, 'small': {'faces': [{'x': 96, 'y': 436, 'h': 110, 'w': 110}]}, 'orig': {'faces': [{'x': 225, 'y': 1023, 'h': 259, 'w': 259}]}}, 'sizes': {'large': {'h': 1593, 'w': 1242, 'resize': 'fit'}, 'medium': {'h': 1200, 'w': 936, 'resize': 'fit'}, 'small': {'h': 680, 'w': 530, 'resize': 'fit'}, 'thumb': {'h': 150, 'w': 150, 'resize': 'crop'}}, 'original_info': {'height': 1593, 'width': 1242, 'focus_rects': [{'x': 0, 'y': 249, 'w': 1242, 'h': 696}, {'x': 0, 'y': 0, 'w': 1242, 'h': 1242}, {'x': 0, 'y': 0, 'w': 1242, 'h': 1416}, {'x': 119, 'y': 0, 'w': 797, 'h': 1593}, {'x': 0, 'y': 0, 'w': 1242, 'h': 1593}]}, 'media_results': {'result': {'media_key': '3_1293235662418673664'}}}]",NYCC has been canceled. Virtual Con will be the way. https://t.co/cPmGXvmw1G
213,Gistlovers.blog1,https://t.co/Gh3TxodISR,Gistloversblog1,,Thu Oct 29 20:43:22 +0000 2020,569156,18,9344,21284,"NYSC is here to stay, FG tells critics calling for scrapping of scheme",Sun Dec 05 14:41:58 +0000 2021,14,161,en,,True,False,11,10,,[],,,14,False,True,9344,21284,,"NYSC is here to stay, FG tells critics calling for scrapping of scheme"
214,Babeto 💰,,faithomino,😋,Fri Nov 13 16:41:41 +0000 2009,3234,1852,1087,22478,"Scrap NYSC! You send kids to strange lands with no accommodation, no protection, poor allowances only for their employers  to turn them to errand boys and girls. A waste of one year where they could have gotten jobs, internships and developed skills.
If they even make it alive😔",Wed Jul 28 13:14:35 +0000 2021,1312,2295,en,,False,False,26,27,,[],,,1312,False,False,1087,22478,,"Scrap NYSC! You send kids to strange lands with no accommodation, no protection, poor allowances only for their employers  to turn them to errand boys and girls. A waste of one year where they could have gotten jobs, internships and developed skills.
If they even make it alive😔"
215,"Olamilekan Samuel, MD🍃",,doctrLakes,Devotion ,Sat Oct 10 17:15:35 +0000 2020,1734,619,139,6296,"I’ve gone for NYSC and I’ve come to conclude it’s almost impossible for Nigeria to scrap that scheme 

Many mouths feeding from it both legally and illegally then there’s NCCF praying “NYSC will never ever die” everyday 

NYSC is forever here with us pa",Sun Dec 29 13:10:21 +0000 2024,407,1941,en,184946,False,False,103,76,,[],,184946,407,False,False,139,6296,,"I’ve gone for NYSC and I’ve come to conclude it’s almost impossible for Nigeria to scrap that scheme 

Many mouths feeding from it both legally and illegally then there’s NCCF praying “NYSC will never ever die” everyday 

NYSC is forever here with us pa"
